{
  "$schema": "http://json-schema.org/draft-07/schema#",
  "title": "Halo Product Configuration",
  "description": "Configuration for Halo build variants (public/internal)",
  "type": "object",
  "required": ["name", "version", "updateConfig", "authProviders"],
  "properties": {
    "$schema": {
      "type": "string"
    },
    "name": {
      "type": "string",
      "description": "Product name"
    },
    "dataFolderName": {
      "type": "string",
      "description": "Data folder name for per-variant isolation. Controls both the Halo config directory (~/.{dataFolderName}/) and Electron userData directory. Defaults to 'halo' when omitted.",
      "pattern": "^[a-z][a-z0-9-]*$",
      "examples": ["halo", "halo-enterprise"]
    },
    "version": {
      "type": "string",
      "description": "Product version"
    },
    "updateConfig": {
      "type": "object",
      "description": "Auto-update configuration",
      "required": ["provider"],
      "properties": {
        "provider": {
          "type": "string",
          "enum": ["github", "generic"],
          "description": "Update provider type"
        },
        "url": {
          "type": "string",
          "description": "URL for generic provider (empty string = disabled)"
        },
        "owner": {
          "type": "string",
          "description": "GitHub repository owner (required for github provider)"
        },
        "repo": {
          "type": "string",
          "description": "GitHub repository name (required for github provider)"
        }
      },
      "if": {
        "properties": { "provider": { "const": "github" } }
      },
      "then": {
        "required": ["provider", "owner", "repo"]
      }
    },
    "authProviders": {
      "type": "array",
      "description": "Authentication provider configurations. An entry can be one of three forms: (1) builtin=true for in-tree providers (e.g. custom), (2) path=... for dynamic OAuth provider modules, (3) preset=... for a fixed-baseUrl API-key form (mutually exclusive with `path`). The `type` field is a free-form identifier; the special value 'preset-api' is recommended for preset entries but the renderer routes purely on the presence of `preset`.",
      "items": {
        "type": "object",
        "required": ["type", "enabled"],
        "properties": {
          "type": {
            "type": "string"
          },
          "displayName": {},
          "description": {},
          "icon": {
            "type": "string"
          },
          "iconBgColor": {
            "type": "string"
          },
          "recommended": {
            "type": "boolean"
          },
          "builtin": {
            "type": "boolean"
          },
          "path": {
            "type": "string"
          },
          "enabled": {
            "type": "boolean"
          },
          "docs": {
            "type": "object",
            "description": "Optional documentation link shown on the login selector card (e.g. how to apply for an account).",
            "required": ["url"],
            "properties": {
              "url": { "type": "string" },
              "label": {
                "description": "Localized text. Defaults to 'Learn more' / '了解更多' if absent."
              }
            }
          },
          "preset": {
            "type": "object",
            "description": "Preset API configuration. When present, this provider renders as an API-key form with a fixed baseUrl. Mutually exclusive with `path` (dynamic OAuth providers).",
            "required": ["baseUrl", "apiType"],
            "properties": {
              "baseUrl": {
                "type": "string",
                "description": "Fixed base URL of the gateway (no path suffix). e.g. 'http://example.com/public'"
              },
              "apiType": {
                "type": "string",
                "enum": ["chat_completions", "responses", "anthropic_passthrough", "kiro"],
                "description": "Persisted to AISource.apiType. Determines dispatch path for Anthropic/Halo SDK engines. Codex engine ignores this and uses OpenAI protocol."
              },
              "modelsPath": {
                "type": "string",
                "description": "Path appended to baseUrl for GET model list. Default: '/v1/models'. The endpoint must return OpenAI-compatible { data: [{ id }] }."
              },
              "fallbackModels": {
                "type": "array",
                "description": "Used when GET models fails or returns empty.",
                "items": {
                  "type": "object",
                  "required": ["id"],
                  "properties": {
                    "id": { "type": "string" },
                    "name": { "type": "string" }
                  }
                }
              },
              "docs": {
                "type": "object",
                "description": "Optional documentation link shown in the form.",
                "required": ["url"],
                "properties": {
                  "url": { "type": "string" },
                  "label": {
                    "description": "Localized text. Defaults to 'Learn more' / '了解更多' if absent."
                  }
                }
              }
            }
          }
        }
      }
    },
    "browserPolicy": {
      "type": "object",
      "description": "Browser network access policy. Controls which domains the embedded browser can navigate to. Omit for unrestricted access (default).",
      "properties": {
        "mode": {
          "type": "string",
          "enum": ["allowlist", "blocklist", "unrestricted"],
          "description": "Policy mode: allowlist = only listed domains allowed, blocklist = listed domains blocked, unrestricted = no restrictions"
        },
        "allowlist": {
          "type": "array",
          "items": { "type": "string" },
          "description": "Domain patterns to allow (e.g. \"*.example.com\", \"intranet.corp.com\"). Used when mode is \"allowlist\"."
        },
        "blocklist": {
          "type": "array",
          "items": { "type": "string" },
          "description": "Domain patterns to block. Used when mode is \"blocklist\"."
        },
        "homepage": {
          "type": "string",
          "description": "Default homepage URL for new browser tabs. Falls back to about:blank when policy is active but homepage is not set."
        },
        "userExtensible": {
          "type": "boolean",
          "description": "Allowlist mode only. When true, users may add their own allowlist entries from the desktop Settings UI and the blocked-page prompt (stored in config.json browser.customAllowlist). User entries can only widen the allowlist; mode and built-in patterns stay fixed. Omit/false to fully lock the allowlist (default)."
        }
      },
      "required": ["mode"]
    },
    "telemetry": {
      "type": "object",
      "description": "Telemetry configuration (enterprise/custom builds only). Controls which user-authored / user-identifiable fields may be forwarded to the self-hosted telemetry backend. Omit for open-source builds — every sensitive field is dropped by default.",
      "properties": {
        "allowedSensitiveFields": {
          "type": "array",
          "items": { "type": "string" },
          "description": "Whitelist of SENSITIVE_KEYS property names permitted to be sent. Recognized keys: specId, spaceName, modelName, sourceName, mcpId, skillId, imBotName, inputTokens, outputTokens, errorCode."
        }
      }
    },
    "security": {
      "type": "object",
      "description": "Security policy for enterprise/custom builds. Each flag follows the '<surface>Safe' convention: true enables restrictions, omitted/false keeps the permissive default. Open-source builds omit this entirely. Flag definitions live in src/main/services/security-policy.ts.",
      "properties": {
        "remoteMcpSafe": {
          "type": "boolean",
          "description": "When true, every remote HTTP endpoint that could land an MCP server configuration (AppSpec type=mcp, mcp_server patch, mcpServers map, store install of MCP type) returns 403. Local UI install paths are unaffected. Use this to prevent remote callers from registering arbitrary native commands."
        },
        "credentialAtRestSafe": {
          "type": "boolean",
          "description": "When true, the stored remote-access credential is encrypted at rest with SM4-CBC plus HMAC-SM3 (encrypt-then-MAC) under a KEK derived via HKDF-SHA-256 from a persisted random master key (userData/cred.key, generated on first run). The master key is stable across restarts, network changes, and hardware reconfiguration; a legacy hostname+MAC-derived seed is retained only to decrypt ciphertext from older builds and is migrated to the master key on next save. When omitted/false (open-source default), the credential is stored as plain text. The plaintext value is held in memory in both modes so the UI can keep displaying the current PIN; login validation uses crypto.timingSafeEqual against the in-memory value."
        },
        "tunnelSafe": {
          "type": "boolean",
          "description": "When true, the Cloudflare Quick Tunnel feature is disabled at every layer: the service refuses to spawn cloudflared, the remote:tunnel:enable IPC short-circuits before reaching the service, and the renderer hides the 'Internet Access' subsection plus the Cloudflared row in System Diagnostics. Use this when policy forbids outbound HTTPS tunnels that bypass the corporate proxy."
        },
        "mcpCommandBlacklist": {
          "type": "array",
          "items": { "type": "string", "minLength": 1 },
          "description": "Command-basename blacklist for stdio-transport MCP servers. Each entry is matched case-insensitively against the basename of mcp_server.command with any .exe suffix stripped (so 'rm' matches both '/usr/bin/rm' and 'C:\\Windows\\rm.exe'). Matching installs are rejected with HTTP 403 / IPC error code MCP_COMMAND_BLOCKED at install time and skipped at runtime if a previously installed entry becomes blacklisted later. SSE / streamable-http transports have no command field and are unaffected. Omit or set to an empty array for no enforcement (open-source default)."
        }
      },
      "additionalProperties": false
    },
    "registryOverrides": {
      "type": "object",
      "description": "Per-built-in-registry override map (enterprise/custom builds only). Keys are built-in registry IDs ('official', 'mcp-official', 'smithery', 'claude-skills', 'skillhub'). Each entry is merged on top of the built-in defaults during ensureBuiltinRegistries() on every startup. Omit any field to keep the built-in default. Open-source builds omit this entirely.",
      "additionalProperties": {
        "type": "object",
        "description": "Override for one built-in registry. Only declared fields are applied; omitted fields retain their built-in defaults.",
        "properties": {
          "url": {
            "type": "string",
            "description": "Replace the registry endpoint (e.g. point to an internal mirror)."
          },
          "name": {
            "type": "string",
            "description": "Replace the display name shown in the Store UI."
          },
          "enabled": {
            "type": "boolean",
            "description": "Force-enable or force-disable the registry on every startup; overrides the user's manual toggle. The entry remains visible in the Store UI, just locked."
          },
          "hidden": {
            "type": "boolean",
            "description": "When true, the registry is removed entirely from the Store UI and any persisted copy from a previous run is dropped on the next startup. Takes precedence over `enabled`. Use this — not `enabled: false` — when policy forbids the registry outright."
          },
          "publish": {
            "type": "object",
            "description": "Publish target. Determines where the App detail 'Publish' button routes the spec.",
            "required": ["target"],
            "properties": {
              "target": {
                "type": "string",
                "enum": ["github-pr", "http-registry", "local-dhpkg"]
              },
              "github": {
                "type": "object",
                "properties": {
                  "owner": { "type": "string" },
                  "repo": { "type": "string" },
                  "clientId": { "type": "string" }
                },
                "required": ["owner", "repo"]
              },
              "token": { "type": "string" }
            }
          }
        },
        "additionalProperties": false
      }
    },
    "builtinApps": {
      "type": "object",
      "description": "Built-in digital humans bundled with the build (VSCode-style built-in extensions). Each entry is materialized into resources/builtin-apps/<specId>/ at build time by scripts/sync-builtin-apps.mjs and auto-installed on first launch by the App Manager. Open-source builds typically omit this field; enterprise builds (e.g. product.<variant>.json) declare their own list pointing to a private SSOT repository.",
      "properties": {
        "sourcePath": {
          "type": "string",
          "description": "Path to the external SSOT directory containing each built-in app folder. Resolved relative to product.json's directory (i.e. project root). Each entry's specId must match a subdirectory containing spec.yaml and an optional skills/ directory. May be overridden at build time via the HALO_BUILTIN_APPS_SOURCE environment variable."
        },
        "apps": {
          "type": "array",
          "description": "List of built-in apps to bundle. The order has no functional meaning.",
          "items": {
            "type": "object",
            "required": ["specId"],
            "properties": {
              "specId": {
                "type": "string",
                "description": "Subdirectory name inside sourcePath. Becomes the canonical spec identifier."
              },
              "spaceId": {
                "type": ["string", "null"],
                "description": "Target space for installation. Use 'halo-temp' for the default temp space, or null for global scope. Defaults to 'halo-temp'."
              },
              "defaultStatus": {
                "type": "string",
                "enum": ["active", "paused"],
                "description": "Initial status when first installed. Use 'paused' for apps that require user configuration or browser login before they can run safely. Defaults to 'paused'."
              }
            },
            "additionalProperties": false
          }
        }
      },
      "required": ["sourcePath", "apps"],
      "additionalProperties": false
    }
  },
  "additionalProperties": false
}
