{
  "$schema": "./product.schema.json",
  "name": "Halo",
  "dataFolderName": "halo",
  "version": "1.0.0",
  "updateConfig": {
    "provider": "github",
    "owner": "openkursar",
    "repo": "hello-halo"
  },
  "authProviders": [
    {
      "type": "claude",
      "displayName": {
        "en": "Claude",
        "zh-CN": "Claude"
      },
      "recommended": true,
      "description": {
        "en": "Claude Pro/Max, login with claude.ai account",
        "zh-CN": "Claude Pro/Max, 使用 claude.ai 账号登录"
      },
      "icon": "log-in",
      "iconBgColor": "#D97757",
      "builtin": true,
      "enabled": true
    },

    {
      "type": "custom",
      "displayName": {
        "en": "Custom API",
        "zh-CN": "自定义 API"
      },
      "description": {
        "en": "Claude / OpenAI compatible",
        "zh-CN": "兼容 Claude / OpenAI"
      },
      "icon": "key",
      "iconBgColor": "#da7756",
      "recommended": false,
      "builtin": true,
      "enabled": true
    },
    {
      "type": "github-copilot",
      "displayName": {
        "en": "GitHub Copilot",
        "zh-CN": "GitHub Copilot"
      },
      "description": {
        "en": "Login with GitHub, use Copilot models",
        "zh-CN": "GitHub 登录，使用 Copilot 模型"
      },
      "icon": "github",
      "iconBgColor": "#24292e",
      "recommended": false,
      "builtin": true,
      "enabled": true
    }
  ]
}
